{
  "$schema": "http://json-schema.org/draft-07/schema#",
  "$id": "https://extrahop.local/eval/case.schema.json",
  "title": "Labeled eval case (ground truth)",
  "type": "object",
  "additionalProperties": false,
  "required": ["id", "prompt", "expected"],
  "properties": {
    "id": { "type": "string" },
    "prompt": { "type": "string", "description": "What the agent is asked to investigate (e.g. a detection id + host)." },
    "group_id": { "type": "string", "description": "Memory namespace for the run; use an isolated evallab namespace." },
    "notes": { "type": "string" },
    "scoring": {
      "type": "object",
      "additionalProperties": false,
      "description": "Which signals this case contributes to. Everything defaults to true; a case is a full test unless it says otherwise.",
      "properties": {
        "disposition": {
          "type": "boolean",
          "description": "Score the verdict (accuracy, confusion, calibration, false-close, false-alarm). Set false for a case whose disposition is not reproducible enough to mean anything — it still scores ladder adherence and cost, and its `expected.disposition` stays as documentation of the right answer. See #128."
        }
      }
    },
    "expected": {
      "type": "object",
      "additionalProperties": false,
      "required": ["disposition", "min_rung"],
      "properties": {
        "disposition": { "type": "string", "enum": ["malicious", "benign", "false-positive", "benign-authorized", "inconclusive"] },
        "attack": { "type": "array", "items": { "type": "string" } },
        "min_rung": { "type": "string", "enum": ["metrics", "records", "packets"], "description": "Deepest evidence rung genuinely required to settle this case." }
      }
    }
  }
}
