{ "id": "c2-beacon-02", "prompt": "Investigate detection 48213 on host 10.0.20.5 (suspected C2 beaconing).", "group_id": "evallab", "expected": { "disposition": "malicious", "attack": ["T1071.001"], "min_rung": "records" }, "notes": "Real periodic beacon to a C2 endpoint; must be corroborated at record tier." }
