{ "id": "ms-telemetry-fp", "prompt": "Investigate IDS detection 4294968251 (ET HUNTING Suspicious POST With Reference to WINDOWS Folder Possible Malware Infection) on 172.16.206.50.", "group_id": "evallab", "notes": "SEED label. Destination is v10.events.data.microsoft.com (legitimate Windows telemetry); a HUNTING rule matching a benign POST. Expected false-positive; confirm the destination + payload via records.", "expected": { "disposition": "false-positive", "attack": [], "min_rung": "records" } }
