{ "id": "unknown-public-dns", "prompt": "Investigate hardening detection 4294968248 (Request to Unknown Public DNS Server) on CA.acmelegal.lab (172.16.204.12).", "group_id": "evallab", "notes": "SEED label. Hardening finding: host queried a public DNS resolver. Peer instances across the JjKOuPro* hosts were closed no_action_taken. Expected benign (real but low-risk config); confirm the resolver + volume via records.", "expected": { "disposition": "benign", "attack": [], "min_rung": "records" } }
