{ "id": "ssdp-dlink-fp", "prompt": "Investigate IDS detection 4294968252 (ET WEB_SPECIFIC_APPS D-Link SSDP ST Header Command Injection Attempt) on 172.16.204.159.", "group_id": "evallab", "notes": "SEED label. Victim is 239.255.255.250 (SSDP/UPnP multicast); normal service discovery matched a D-Link CVE signature aimed at a multicast address. Expected false-positive; the destination alone is largely dispositive.", "expected": { "disposition": "false-positive", "attack": [], "min_rung": "metrics" } }
