{ "id": "smbv1-dc", "prompt": "Investigate hardening detection 4294968253 (SMBv1 Connection) on nlQAWDC1.acmelegal.lab (172.16.204.10).", "group_id": "evallab", "notes": "SEED label. Real hygiene finding — SMBv1 in use on a domain controller. Benign (not an incident) but a genuine remediation item. Confirm participants/scope via records.", "expected": { "disposition": "benign", "attack": [], "min_rung": "records" } }
